{
  "tool_id": "enhanced_hole_maker_v1",
  "metadata": {
    "version": "1.1.0",
    "author": "ATDF Team",
    "tags": ["construction", "drilling", "tool"],
    "category": "construction",
    "created_at": "2025-04-01",
    "updated_at": "2025-04-15"
  },
  "localization": {
    "es": {
      "description": "Crea agujeros en diversas superficies",
      "when_to_use": "Usar cuando necesites hacer un agujero en una pared, madera, metal u otra superficie sólida."
    },
    "pt": {
      "description": "Cria furos em várias superfícies",
      "when_to_use": "Use quando precisar fazer um furo em uma parede, madeira, metal ou outra superfície sólida."
    }
  },
  "description": "Creates holes in various surfaces",
  "when_to_use": "Use when you need to make a hole in a wall, wood, metal, or other solid surface.",
  "prerequisites": {
    "tools": ["safety_goggles", "measuring_tape"],
    "conditions": ["stable_surface", "proper_ventilation"],
    "permissions": ["adult_supervision_for_minors"]
  },
  "how_to_use": {
    "inputs": [
      {
        "name": "diameter",
        "type": "number",
        "description": "The diameter of the hole in millimeters"
      },
      {
        "name": "surface_type",
        "type": "string",
        "description": "Type of surface (e.g., wall, wood, metal)"
      },
      {
        "name": "depth",
        "type": "number",
        "description": "The depth of the hole in millimeters"
      },
      {
        "name": "precision",
        "type": "string",
        "description": "Level of precision required (standard, high, ultra)",
        "schema": {
          "enum": ["standard", "high", "ultra"]
        }
      }
    ],
    "outputs": {
      "success": "The hole has been created with the specified parameters.",
      "failure": [
        {
          "code": "invalid_diameter",
          "description": "The diameter must be between 1mm and 100mm."
        },
        {
          "code": "invalid_surface",
          "description": "The surface type is not supported."
        },
        {
          "code": "invalid_depth",
          "description": "The depth must be between 1mm and 500mm."
        },
        {
          "code": "invalid_precision",
          "description": "The precision level is not valid."
        }
      ]
    }
  },
  "feedback": {
    "progress_indicators": [
      "Drill sound",
      "Visible dust or material being removed",
      "Drill bit heating up"
    ],
    "completion_signals": [
      "Drill reaching set depth",
      "Drill bit passing through material completely"
    ]
  },
  "examples": [
    {
      "goal": "Make a mounting hole for a wall shelf",
      "input_values": {
        "diameter": 8,
        "surface_type": "concrete wall",
        "depth": 50,
        "precision": "standard"
      },
      "expected_result": "An 8mm diameter hole, 50mm deep in the concrete wall"
    },
    {
      "goal": "Create precision hole for cabinet hinge",
      "input_values": {
        "diameter": 5,
        "surface_type": "wood",
        "depth": 12,
        "precision": "high"
      },
      "expected_result": "A precisely positioned 5mm diameter hole, 12mm deep in the wood"
    }
  ]
} 